### ISSUE TITLE
Notification received: Unrecognized Well-known Attribute

### ISSUE THREAD

**Issue by pierky** [openbgpd-portable/openbgpd-portable#64]
Hello @cjeker,

I'm observing a weird behaviour with OpenBGPD Portable 8.1 and 8.2.

I'm using it as a route-server (test suite of ARouteServer), with some BIRD instances acting as clients.
When the session comes up, BIRD tears it down with a `Notification Message (3), length: 24, UPDATE Message Error (3), subcode Unrecognized Well-known Attribute (2)`. This is what it logs:

```
2023-10-10 10:16:32 <RMT> the_rs: Error: Unrecognized well-known attribute: 000000
```

In the same environment, if I just swap the version of OpenBGPD from 8.1 or 8.2 to 8.0, everything works as expected.

I was able to capture the BGP traffic. I'm attaching it here as .pcap, also the config of the RS is attached.

Hope you could have a look at it when you have a chance.

Thanks

Here:
- 192.0.2.2 is the route-server, OpenBGPD portable 8.1
- 192.0.2.11 is the route-server client, BIRD 1.6.8

```
BIRD -> OpenBGPD, OPEN
10:20:17.855823 IP (tos 0xc0, ttl 1, id 18761, offset 0, flags [DF], proto TCP (6), length 105)
    192.0.2.11.51745 > 192.0.2.2.179: Flags [P.], cksum 0x8469 (incorrect -> 0xe03a), seq 1:54, ack 1, win 502, options [nop,nop,TS val 3354960121 ecr 3980044570], length 53: BGP
	Open Message (1), length: 53
	  Version 4, my AS 1, Holdtime 240s, ID 192.0.2.11
	  Optional parameters, length: 24
	    Option Capabilities Advertisement (2), length: 22
	      Multiprotocol Extensions (1), length: 4
		AFI IPv4 (1), SAFI Unicast (1)
	      Route Refresh (2), length: 0
	      Graceful Restart (64), length: 2
		Restart Flags: [none], Restart Time 0s
	      32-Bit AS Number (65), length: 4
		 4 Byte AS 1
	      Enhanced Route Refresh (70), length: 0
		no decoder for Capability 70
	      Unknown (71), length: 0
		no decoder for Capability 71

10:20:17.855838 IP (tos 0x0, ttl 255, id 5255, offset 0, flags [DF], proto TCP (6), length 52)
    192.0.2.2.179 > 192.0.2.11.51745: Flags [.], cksum 0x8434 (incorrect -> 0xe084), ack 54, win 509, options [nop,nop,TS val 3980044570 ecr 3354960121], length 0

OpenBGPD -> BIRD, OPEN
10:20:17.856014 IP (tos 0xc0, ttl 1, id 5256, offset 0, flags [DF], proto TCP (6), length 101)
    192.0.2.2.179 > 192.0.2.11.51745: Flags [P.], cksum 0x8465 (incorrect -> 0xfec8), seq 1:50, ack 54, win 509, options [nop,nop,TS val 3980044570 ecr 3354960121], length 49: BGP
	Open Message (1), length: 49
	  Version 4, my AS 999, Holdtime 90s, ID 192.0.2.2
	  Optional parameters, length: 20
	    Option Capabilities Advertisement (2), length: 18
	      Multiprotocol Extensions (1), length: 4
		AFI IPv4 (1), SAFI Unicast (1)
	      Route Refresh (2), length: 0
	      Graceful Restart (64), length: 2
		Restart Flags: [R], Restart Time 0s
	      32-Bit AS Number (65), length: 4
		 4 Byte AS 999

10:20:17.856024 IP (tos 0xc0, ttl 1, id 18762, offset 0, flags [DF], proto TCP (6), length 52)
    192.0.2.11.51745 > 192.0.2.2.179: Flags [.], cksum 0x8434 (incorrect -> 0xe05a), ack 50, win 502, options [nop,nop,TS val 3354960121 ecr 3980044570], length 0
10:20:17.856057 IP (tos 0xc0, ttl 1, id 5257, offset 0, flags [DF], proto TCP (6), length 71)
    192.0.2.2.179 > 192.0.2.11.51745: Flags [P.], cksum 0x8447 (incorrect -> 0xdc25), seq 50:69, ack 54, win 509, options [nop,nop,TS val 3980044570 ecr 3354960121], length 19: BGP
	Keepalive Message (4), length: 19
10:20:17.856060 IP (tos 0xc0, ttl 1, id 18763, offset 0, flags [DF], proto TCP (6), length 52)
    192.0.2.11.51745 > 192.0.2.2.179: Flags [.], cksum 0x8434 (incorrect -> 0xe047), ack 69, win 502, options [nop,nop,TS val 3354960121 ecr 3980044570], length 0
10:20:17.856360 IP (tos 0xc0, ttl 1, id 18764, offset 0, flags [DF], proto TCP (6), length 71)
    192.0.2.11.51745 > 192.0.2.2.179: Flags [P.], cksum 0x8447 (incorrect -> 0xdc19), seq 54:73, ack 69, win 502, options [nop,nop,TS val 3354960121 ecr 3980044570], length 19: BGP
	Keepalive Message (4), length: 19

OpenBGPD -> BIRD, updates
10:20:17.857361 IP (tos 0xc0, ttl 1, id 5258, offset 0, flags [DF], proto TCP (6), length 529)
    192.0.2.2.179 > 192.0.2.11.51745: Flags [P.], cksum 0x8611 (incorrect -> 0xf14f), seq 69:546, ack 73, win 509, options [nop,nop,TS val 3980044571 ecr 3354960121], length 477: BGP
	Update Message (2), length: 82
	  Origin (1), length: 1, Flags [T]: IGP
	  AS Path (2), length: 6, Flags [T]: 4
	  Next Hop (3), length: 4, Flags [T]: 192.0.2.66
	  Community (8), length: 12, Flags [OT]: 65530:4, 65535:666,  NO_EXPORT
	  Unknown Attribute (0), length: 0
	    no Attribute 0 decoder
	  Unknown Attribute (192), length: 32, Flags [+1]: [|BGP]
	Update Message (2), length: 71
	  Origin (1), length: 1, Flags [T]: IGP
	  AS Path (2), length: 6, Flags [T]: 4
	  Next Hop (3), length: 4, Flags [T]: 192.0.2.41
	  Updated routes:
	    4.0.1.0/24
	    4.0.2.0/24
	    4.0.3.0/24
	    4.0.4.0/24
	    4.0.5.0/24
	    4.0.8.0/24
	    4.0.10.0/24
	Update Message (2), length: 72
	  Origin (1), length: 1, Flags [T]: IGP
	  AS Path (2), length: 20, Flags [T]: 222 333 { 444 555 }
	  Next Hop (3), length: 4, Flags [T]: 192.0.2.222
	  Aggregator (7), length: 8, Flags [OT]:  AS #333, origin 192.0.2.223
	  Updated routes:
	    222.3.3.0/24
	Update Message (2), length: 72
	  Origin (1), length: 1, Flags [T]: IGP
	  AS Path (2), length: 20, Flags [T]: 222 333 { 333 333 }
	  Next Hop (3), length: 4, Flags [T]: 192.0.2.222
	  Aggregator (7), length: 8, Flags [OT]:  AS #333, origin 192.0.2.223
	  Updated routes:
	    222.2.2.0/24
	Update Message (2), length: 59
	  Origin (1), length: 1, Flags [T]: IGP
	  AS Path (2), length: 18, Flags [T]: 4 4 4 4
	  Next Hop (3), length: 4, Flags [T]: 192.0.2.41
	  Updated routes:
	    4.0.9.0/24
	Update Message (2), length: 51
	  Origin (1), length: 1, Flags [T]: IGP
	  AS Path (2), length: 6, Flags [T]: 1
	  Next Hop (3), length: 4, Flags [T]: 192.0.2.12
	  Updated routes:
	    1.0.1.0/24
	    1.0.2.0/24
	Update Message (2), length: 47
	  Origin (1), length: 1, Flags [T]: IGP
	  AS Path (2), length: 6, Flags [T]: 1
	  Next Hop (3), length: 4, Flags [T]: 192.0.2.11
	  Updated routes:
	    1.0.3.0/24
	Update Message (2), length: 23
	  End-of-Rib Marker (empty NLRI)

BIRD -> OpenBGPD, updates + final NOTIFICATION
10:20:17.857649 IP (tos 0xc0, ttl 1, id 18765, offset 0, flags [DF], proto TCP (6), length 113)
    192.0.2.11.51745 > 192.0.2.2.179: Flags [P.], cksum 0x8471 (incorrect -> 0x211d), seq 73:134, ack 546, win 501, options [nop,nop,TS val 3354960123 ecr 3980044571], length 61: BGP
	Update Message (2), length: 61
	  Origin (1), length: 1, Flags [T]: IGP
	  AS Path (2), length: 6, Flags [T]: 1
	  Next Hop (3), length: 4, Flags [T]: 192.0.2.11
	  Updated routes:
	    1.0.1.0/24
	    1.0.2.0/24
	    10.0.0.0/24
	    128.0.0.0/7
	    192.0.2.0/24
10:20:17.857970 IP (tos 0xc0, ttl 1, id 18766, offset 0, flags [DF], proto TCP (6), length 1323)
    192.0.2.11.51745 > 192.0.2.2.179: Flags [FP.], cksum 0x892b (incorrect -> 0x66a9), seq 134:1405, ack 546, win 501, options [nop,nop,TS val 3354960123 ecr 3980044571], length 1271: BGP
	Update Message (2), length: 62
	  Origin (1), length: 1, Flags [T]: IGP
	  AS Path (2), length: 10, Flags [T]: 1 1011
	  Next Hop (3), length: 4, Flags [T]: 192.0.2.11
	  Updated routes:
	    11.2.1.0/24
	    11.3.1.0/24
	    11.3.0.0/16
	    11.1.1.0/24
	Update Message (2), length: 55
	  Origin (1), length: 1, Flags [T]: IGP
	  AS Path (2), length: 10, Flags [T]: 1 1000
	  Next Hop (3), length: 4, Flags [T]: 192.0.2.11
	  Updated routes:
	    11.1.2.0/24
	    11.4.1.0/24
	Update Message (2), length: 66
	  Origin (1), length: 1, Flags [T]: IGP
	  AS Path (2), length: 10, Flags [T]: 1 101
	  Next Hop (3), length: 4, Flags [T]: 192.0.2.11
	  Large Community (32), length: 12, Flags [OT]:
	    888:0:0
	  Updated routes:
	    101.0.5.0/24
	Update Message (2), length: 58
	  Origin (1), length: 1, Flags [T]: IGP
	  AS Path (2), length: 10, Flags [T]: 1 101
	  Next Hop (3), length: 4, Flags [T]: 192.0.2.11
	  Community (8), length: 4, Flags [OT]: 888:0
	  Updated routes:
	    101.0.4.0/24
	Update Message (2), length: 79
	  Origin (1), length: 1, Flags [T]: IGP
	  AS Path (2), length: 10, Flags [T]: 1 101
	  Next Hop (3), length: 4, Flags [T]: 192.0.2.11
	  Updated routes:
	    101.1.0.0/24
	    101.0.1.0/24
	    101.0.9.0/24
	    101.2.1.0/24
	    101.0.8.0/24
	    101.2.0.0/17
	    101.0.128.0/24
	    101.2.128.0/24
	Update Message (2), length: 55
	  Origin (1), length: 1, Flags [T]: IGP
	  AS Path (2), length: 14, Flags [T]: 1 101 174
	  Next Hop (3), length: 4, Flags [T]: 192.0.2.11
	  Updated routes:
	    101.0.7.0/24
	Update Message (2), length: 89
	  Origin (1), length: 1, Flags [T]: IGP
	  AS Path (2), length: 10, Flags [T]: 1 101
	  Next Hop (3), length: 4, Flags [T]: 192.0.2.11
	  Community (8), length: 8, Flags [OT]: 777:0, 65530:1
	  Large Community (32), length: 24, Flags [OT]:
	    777:0:0, 999:65530:1
	  Updated routes:
	    101.0.6.0/24
	Update Message (2), length: 59
	  Origin (1), length: 1, Flags [T]: IGP
	  AS Path (2), length: 18, Flags [T]: 1 101 101 103
	  Next Hop (3), length: 4, Flags [T]: 192.0.2.11
	  Updated routes:
	    103.0.2.0/24
	Update Message (2), length: 66
	  Origin (1), length: 1, Flags [T]: IGP
	  AS Path (2), length: 10, Flags [T]: 1 101
	  Next Hop (3), length: 4, Flags [T]: 192.0.2.11
	  Large Community (32), length: 12, Flags [OT]:
	    999:65530:0
	  Updated routes:
	    101.0.3.0/24
	Update Message (2), length: 62
	  Origin (1), length: 1, Flags [T]: IGP
	  AS Path (2), length: 14, Flags [T]: 1 101 103
	  Next Hop (3), length: 4, Flags [T]: 192.0.2.11
	  Community (8), length: 4, Flags [OTP]: 65535:0
	  Updated routes:
	    103.0.1.0/24
	Update Message (2), length: 58
	  Origin (1), length: 1, Flags [T]: IGP
	  AS Path (2), length: 10, Flags [T]: 1 101
	  Next Hop (3), length: 4, Flags [T]: 192.0.2.11
	  Community (8), length: 4, Flags [OT]: 65530:0
	  Updated routes:
	    101.0.2.0/24
	Update Message (2), length: 55
	  Origin (1), length: 1, Flags [T]: IGP
	  AS Path (2), length: 14, Flags [T]: 1 101 102
	  Next Hop (3), length: 4, Flags [T]: 192.0.2.11
	  Updated routes:
	    102.0.1.0/24
	Update Message (2), length: 59
	  Origin (1), length: 1, Flags [T]: IGP
	  AS Path (2), length: 14, Flags [T]: 1 101 104
	  Next Hop (3), length: 4, Flags [T]: 192.0.2.11
	  Updated routes:
	    104.0.1.0/24
	    104.1.1.0/24
	Update Message (2), length: 55
	  Origin (1), length: 1, Flags [T]: IGP
	  AS Path (2), length: 14, Flags [T]: 1 101 105
	  Next Hop (3), length: 4, Flags [T]: 192.0.2.11
	  Updated routes:
	    101.3.0.0/24
	Update Message (2), length: 55
	  Origin (1), length: 1, Flags [T]: IGP
	  AS Path (2), length: 14, Flags [T]: 1 101 777
	  Next Hop (3), length: 4, Flags [T]: 192.0.2.11
	  Updated routes:
	    101.0.11.0/24
	Update Message (2), length: 55
	  Origin (1), length: 1, Flags [T]: IGP
	  AS Path (2), length: 14, Flags [T]: 1 101 666
	  Next Hop (3), length: 4, Flags [T]: 192.0.2.11
	  Updated routes:
	    101.0.10.0/24
	Update Message (2), length: 49
	  Origin (1), length: 1, Flags [T]: IGP
	  AS Path (2), length: 10, Flags [T]: 2 1
	  Next Hop (3), length: 4, Flags [T]: 192.0.2.11
	  Updated routes:
	    128.0.0.0/8
	Update Message (2), length: 54
	  Origin (1), length: 1, Flags [T]: IGP
	  AS Path (2), length: 14, Flags [T]: 1 65536 1
	  Next Hop (3), length: 4, Flags [T]: 192.0.2.11
	  Updated routes:
	    128.0.0.0/9
	Update Message (2), length: 74
	  Origin (1), length: 1, Flags [T]: IGP
	  AS Path (2), length: 34, Flags [T]: 1 2 2 2 2 2 2 1
	  Next Hop (3), length: 4, Flags [T]: 192.0.2.11
	  Updated routes:
	    128.0.0.0/10
	Update Message (2), length: 59
	  Origin (1), length: 1, Flags [T]: IGP
	  AS Path (2), length: 10, Flags [T]: 1 101
	  Next Hop (3), length: 4, Flags [T]: 192.0.2.11
	  Community (8), length: 4, Flags [OT]: 65535:666
	  Updated routes:
	    101.0.128.1/32
	Update Message (2), length: 23
	  End-of-Rib Marker (empty NLRI)
	Notification Message (3), length: 24, UPDATE Message Error (3), subcode Unrecognized Well-known Attribute (2)
```

This is what Wireshark sees:

<img width="798" alt="image" src="https://github.com/openbgpd-portable/openbgpd-portable/assets/6806218/13124915-4b30-4c0a-af93-dd78691eddd5">

Attachments:
- [bgp.pcap.zip](https://github.com/openbgpd-portable/openbgpd-portable/files/12856049/bgp.pcap.zip)
- [rs.config.zip](https://github.com/openbgpd-portable/openbgpd-portable/files/12856055/rs.config.zip)

**Comment by cjeker** [comment]
On Tue, Oct 10, 2023 at 03:39:51AM -0700, Pier Carlo Chiodi wrote:
> Hello @cjeker,
> 
> I'm observing a weird behaviour with OpenBGPD Portable 8.1 and 8.2.
> 
> I'm using it as a route-server (test suite of ARouteServer), with some BIRD instances acting as clients.
> When the session comes up, BIRD tears it down with a `Notification Message (3), length: 24, UPDATE Message Error (3), subcode Unrecognized Well-known Attribute (2)`. This is what it logs:
> 
> ```
> 2023-10-10 10:16:32 <RMT> the_rs: Error: Unrecognized well-known attribute: 000000
> ```
> 
> In the same environment, if I just swap the version of OpenBGPD from 8.1 or 8.2 to 8.0, everything works as expected.
> 
> I was able to capture the BGP traffic. I'm attaching it here as .pcap, also the config of the RS is attached.
> 
> Hope you could have a look at it when you have a chance.
 
Could you try the following diff?

The way non-transitive ext-communities are handled may cause an error when
writing out the communities.

-- 
:wq Claudio

Index: rde_community.c
===================================================================
RCS file: /cvs/src/usr.sbin/bgpd/rde_community.c,v
retrieving revision 1.13
diff -u -p -r1.13 rde_community.c
--- rde_community.c	12 Jul 2023 14:45:43 -0000	1.13
+++ rde_community.c	10 Oct 2023 13:26:00 -0000
@@ -583,6 +583,8 @@ community_writebuf(struct rde_community 
 	/* write out the communities */
 	for (l = start; l < end; l++) {
 		cp = &comm->communities[l];
+		if (ebgp && non_transitive_ext_community(cp))
+			continue;
 
 		switch (type) {
 		case ATTR_COMMUNITIES:
@@ -592,9 +594,6 @@ community_writebuf(struct rde_community 
 				return -1;
 			break;
 		case ATTR_EXT_COMMUNITIES:
-			if (ebgp && non_transitive_ext_community(cp))
-				continue;
-
 			ext = (uint64_t)cp->data3 << 48;
 			switch ((cp->data3 >> 8) & EXT_COMMUNITY_VALUE) {
 			case EXT_COMMUNITY_TRANS_TWO_AS:

**Comment by cjeker** [comment]
Actually there is a better diff on the tech@ mailing list. See https://marc.info/?l=openbsd-tech&m=169694559603282&w=2

Stupid github does not allow me to attach the file here. So I'm giving up. Tried both .txt and .patch neither worked.

**Comment by pierky** [comment]
@cjeker thanks, the diff from the tech mailing list works for 8.1 and 8.2.

Is the plan to include it in a future portable release? If so, any estimate of when that will be published?

Thanks

**Comment by cjeker** [comment]
@pierky, the plan is to release 8.3 in the next days.

**Comment by cjeker** [comment]
OpenBGPD-portable 8.3 is out. The tarballs should show up on the mirrors shortly.
Also as a workaround you can remove the non-transitive ext-communities by adding a rule like:
`match to ebgp set ext-community delete ovs *` to the config.
